{
  "document_type": "schema_inventory",
  "provenance": {
    "broker_execution": false,
    "command": "schema-inventory",
    "examples_dir": "examples/outputs",
    "live_market_data": false,
    "private_context": false,
    "schema_dir": "docs",
    "shell_out": false
  },
  "schema_version": "0.26",
  "schemas": [
    {
      "document_type": "artifact_validation",
      "examples": [
        "examples/outputs/artifact_validation.json"
      ],
      "path": "docs/artifact-validation.schema.json",
      "public_safety_notes": [
        "requires live_market_data: false",
        "requires shell_out: false",
        "requires private_context: false",
        "requires broker_execution: false",
        "requires provenance"
      ],
      "required_top_level_fields": [
        "schema_version",
        "document_type",
        "summary",
        "artifacts",
        "provenance"
      ],
      "schema_version": "0.26",
      "title": "Artifact Validation"
    },
    {
      "document_type": "asset_hub",
      "examples": [
        "examples/outputs/asset_hub.json"
      ],
      "path": "docs/asset-hub.schema.json",
      "public_safety_notes": [
        "requires not_investment_advice",
        "requires live_market_data: false",
        "requires shell_out: false",
        "requires private_context: false",
        "requires provenance"
      ],
      "required_top_level_fields": [
        "schema_version",
        "document_type",
        "not_investment_advice",
        "product_positioning",
        "command_map",
        "demo_artifact_map",
        "readiness_checklist",
        "safety_boundaries",
        "agent_skill_path",
        "release_checklist",
        "roadmap",
        "inputs",
        "provenance"
      ],
      "schema_version": "0.25",
      "title": "Public Asset Hub"
    },
    {
      "document_type": "audit_trail",
      "examples": [
        "examples/outputs/audit_trail.json"
      ],
      "path": "docs/audit-trail.schema.json",
      "public_safety_notes": [
        "requires live_market_data: false",
        "requires shell_out: false",
        "requires provenance"
      ],
      "required_top_level_fields": [
        "schema_version",
        "document_type",
        "inputs",
        "summary",
        "artifacts",
        "checklist",
        "ledger_rows",
        "provenance"
      ],
      "schema_version": "0.20",
      "title": "Audit Trail"
    },
    {
      "document_type": "run_comparison",
      "examples": [
        "examples/outputs/compare_runs.json"
      ],
      "path": "docs/compare-runs.schema.json",
      "public_safety_notes": [],
      "required_top_level_fields": [
        "schema_version",
        "document_type",
        "inputs",
        "base",
        "candidate",
        "deltas"
      ],
      "schema_version": "0.5",
      "title": "Leveraged ETP run comparison output"
    },
    {
      "document_type": "cycle_state",
      "examples": [
        "examples/outputs/cycle_state.json"
      ],
      "path": "docs/cycle-state.schema.json",
      "public_safety_notes": [
        "requires not_investment_advice",
        "requires live_market_data: false",
        "requires shell_out: false",
        "requires provenance"
      ],
      "required_top_level_fields": [
        "schema_version",
        "document_type",
        "not_investment_advice",
        "state_id",
        "inputs",
        "summary",
        "baseline_artifact_hashes",
        "baseline_watch_items",
        "baseline_risks",
        "open_checks",
        "review_cadence",
        "provenance"
      ],
      "schema_version": "0.22",
      "title": "Watch Cycle State"
    },
    {
      "document_type": "cycle_update",
      "examples": [
        "examples/outputs/cycle_update.json"
      ],
      "path": "docs/cycle-update.schema.json",
      "public_safety_notes": [
        "requires not_investment_advice",
        "requires live_market_data: false",
        "requires shell_out: false",
        "requires provenance"
      ],
      "required_top_level_fields": [
        "schema_version",
        "document_type",
        "not_investment_advice",
        "state_id",
        "inputs",
        "summary",
        "watch_items",
        "hash_drift",
        "status_transitions",
        "next_review_actions",
        "provenance"
      ],
      "schema_version": "0.22",
      "title": "Watch Cycle Update"
    },
    {
      "document_type": "demo_story",
      "examples": [
        "examples/outputs/demo_story.json"
      ],
      "path": "docs/demo-story.schema.json",
      "public_safety_notes": [
        "requires not_investment_advice",
        "requires provenance"
      ],
      "required_top_level_fields": [
        "schema_version",
        "document_type",
        "not_investment_advice",
        "inputs",
        "sections",
        "provenance"
      ],
      "schema_version": "0.12",
      "title": "Leveraged ETP Risk Lab Public Demo Story"
    },
    {
      "document_type": "docs_export",
      "examples": [
        "examples/outputs/docs_export.json"
      ],
      "path": "docs/docs-export.schema.json",
      "public_safety_notes": [
        "requires live_market_data: false",
        "requires private_context: false",
        "requires provenance"
      ],
      "required_top_level_fields": [
        "schema_version",
        "document_type",
        "title",
        "summary",
        "sources",
        "safety_caveats",
        "command_map",
        "integration_notes",
        "release_notes",
        "local_artifact_links",
        "markdown_artifacts",
        "provenance"
      ],
      "schema_version": "0.30",
      "title": "Docs Export"
    },
    {
      "document_type": null,
      "examples": [
        "examples/outputs/portfolio_exposure.json"
      ],
      "path": "docs/exposure-report.schema.json",
      "public_safety_notes": [],
      "required_top_level_fields": [
        "schema_version",
        "portfolio",
        "summary",
        "positions",
        "portfolio_path",
        "stop_events",
        "warnings"
      ],
      "schema_version": "0.2",
      "title": "Leveraged ETP exposure report output"
    },
    {
      "document_type": "factsheet_check",
      "examples": [
        "examples/outputs/factsheet_check.json"
      ],
      "path": "docs/factsheet-check.schema.json",
      "public_safety_notes": [
        "requires not_investment_advice",
        "requires provenance"
      ],
      "required_top_level_fields": [
        "schema_version",
        "document_type",
        "not_investment_advice",
        "inputs",
        "product",
        "summary",
        "checks",
        "missing_fields",
        "provenance"
      ],
      "schema_version": "0.15",
      "title": "Product Factsheet Checklist"
    },
    {
      "document_type": "gallery_index",
      "examples": [
        "examples/outputs/gallery_index.json"
      ],
      "path": "docs/gallery-index.schema.json",
      "public_safety_notes": [
        "requires provenance"
      ],
      "required_top_level_fields": [
        "schema_version",
        "document_type",
        "input_dir",
        "summary",
        "stages",
        "provenance"
      ],
      "schema_version": "0.13",
      "title": "Leveraged ETP Risk Lab Public Gallery Index"
    },
    {
      "document_type": "glossary",
      "examples": [
        "examples/outputs/glossary.json"
      ],
      "path": "docs/glossary.schema.json",
      "public_safety_notes": [
        "requires not_investment_advice",
        "requires provenance"
      ],
      "required_top_level_fields": [
        "schema_version",
        "document_type",
        "not_investment_advice",
        "summary",
        "terms",
        "provenance"
      ],
      "schema_version": "0.14",
      "title": "Leveraged Product Glossary"
    },
    {
      "document_type": "guardrail_check",
      "examples": [
        "examples/outputs/guardrail_check.json"
      ],
      "path": "docs/guardrail-check.schema.json",
      "public_safety_notes": [
        "requires not_investment_advice",
        "requires live_market_data: false",
        "requires shell_out: false",
        "requires provenance"
      ],
      "required_top_level_fields": [
        "schema_version",
        "document_type",
        "not_investment_advice",
        "inputs",
        "policy",
        "summary",
        "observed",
        "rules",
        "violated_rules",
        "next_actions",
        "provenance"
      ],
      "schema_version": "0.23",
      "title": "Allocation Guardrail Check"
    },
    {
      "document_type": "guardrail_policy",
      "examples": [
        "examples/outputs/guardrail_policy.json"
      ],
      "path": "docs/guardrail-policy.schema.json",
      "public_safety_notes": [
        "requires not_investment_advice",
        "requires live_market_data: false",
        "requires shell_out: false",
        "requires provenance"
      ],
      "required_top_level_fields": [
        "schema_version",
        "document_type",
        "not_investment_advice",
        "policy_id",
        "name",
        "description",
        "limits",
        "required_artifacts",
        "review_conditions",
        "provenance"
      ],
      "schema_version": "0.23",
      "title": "Allocation Guardrail Policy"
    },
    {
      "document_type": "investment_memo_review",
      "examples": [
        "examples/outputs/investment_memo_review.json"
      ],
      "path": "docs/investment-memo-review.schema.json",
      "public_safety_notes": [
        "requires not_investment_advice",
        "requires live_market_data: false",
        "requires shell_out: false",
        "requires provenance"
      ],
      "required_top_level_fields": [
        "schema_version",
        "document_type",
        "not_investment_advice",
        "inputs",
        "summary",
        "changed_risks",
        "checklist",
        "next_actions",